{"appliedElements":[{"actualRasterBounds":{"height":352,"width":864,"x":108,"y":1088},"assetDigest":"fd5d6e48ebbf443f10f40af1b70091649b208bc7118f64dc3a990434915fc2fe","assetId":"hero","destinationPixelRect":{"height":442,"width":864,"x":108,"y":998},"elementId":"hero","elementType":"IMAGE","fitMode":"COVER","normalizedBounds":{"height":0.23,"width":0.8,"x":0.1,"y":0.52},"opacity":1,"originalArrayIndex":4,"placementPolicy":"MANUAL_CROP","requestedCropRect":{"height":1,"width":0.72,"x":0.14,"y":0},"resolvedSourceCropPixels":{"height":160,"width":188,"x":36,"y":0},"safeZoneImportance":"KEY_CREATIVE","zIndex":1},{"actualRasterBounds":{"height":87,"width":195,"x":799,"y":384},"destinationPixelRect":{"height":87,"width":195,"x":799,"y":384},"elementId":"accent-badge","elementType":"SHAPE","normalizedBounds":{"height":0.045,"width":0.18,"x":0.74,"y":0.2},"opacity":1,"originalArrayIndex":1,"safeZoneImportance":"DECORATIVE","zIndex":3},{"actualRasterBounds":{"height":57,"width":293,"x":86,"y":427},"assetDigest":"9f4a782a84b1e841f2c8fd86221dd9b3fc2cb82a30d01fd2720dec0ad7823237","assetId":"logo","destinationPixelRect":{"height":57,"width":293,"x":86,"y":427},"elementId":"brand-logo","elementType":"LOGO","fitMode":"CONTAIN","normalizedBounds":{"height":0.075,"width":0.27,"x":0.08,"y":0.2},"opacity":1,"originalArrayIndex":0,"placementPolicy":"ALPHA_TRIM_CONTAIN","resolvedSourceCropPixels":{"height":24,"width":124,"x":38,"y":18},"safeZoneImportance":"KEY_CREATIVE","zIndex":4},{"actualRasterBounds":{"height":136,"width":496,"x":88,"y":586},"clipped":false,"color":"#20262D","destinationPixelRect":{"height":250,"width":908,"x":86,"y":576},"elementId":"headline","elementType":"TEXT","fontAssetDigest":"5a6b9b258145e243dfd5f70cc869119c6af708843658e380304bdfe3d4f4eaef","fontId":"SPOQA_HAN_SANS_BOLD","fontSizePx":64,"lineHeightPx":76,"normalizedBounds":{"height":0.13,"width":0.84,"x":0.08,"y":0.3},"opacity":1,"originalArrayIndex":2,"overflowDetected":false,"overflowMode":"ERROR","safeZoneImportance":"KEY_CREATIVE","wrapMode":"EXPLICIT_NEWLINES","zIndex":5},{"actualRasterBounds":{"height":27,"width":326,"x":87,"y":888},"clipped":false,"color":"#20262D","destinationPixelRect":{"height":116,"width":908,"x":86,"y":883},"elementId":"subcopy","elementType":"TEXT","fontAssetDigest":"1f56c8535b6592672ea7f540a67bb5792c34558d72875fc504166a3e2b28b4b1","fontId":"SPOQA_HAN_SANS_REGULAR","fontSizePx":30,"lineHeightPx":40,"normalizedBounds":{"height":0.06,"width":0.84,"x":0.08,"y":0.46},"opacity":1,"originalArrayIndex":3,"overflowDetected":false,"overflowMode":"ERROR","safeZoneImportance":"KEY_CREATIVE","wrapMode":"NO_WRAP","zIndex":5}],"assetDigests":{"approvedIcons":[],"fonts":[{"id":"SPOQA_HAN_SANS_BOLD","sha256":"5a6b9b258145e243dfd5f70cc869119c6af708843658e380304bdfe3d4f4eaef"},{"id":"SPOQA_HAN_SANS_REGULAR","sha256":"1f56c8535b6592672ea7f540a67bb5792c34558d72875fc504166a3e2b28b4b1"}],"images":[{"id":"hero","sha256":"fd5d6e48ebbf443f10f40af1b70091649b208bc7118f64dc3a990434915fc2fe"},{"id":"logo","sha256":"9f4a782a84b1e841f2c8fd86221dd9b3fc2cb82a30d01fd2720dec0ad7823237"}],"product":{"id":"hero","sha256":"fd5d6e48ebbf443f10f40af1b70091649b208bc7118f64dc3a990434915fc2fe"},"referenceFixture":{"id":"KAKAO_TOOL_OBJECT_RIGHT_1029X258","sha256":"33204a082327bf14fead6dbc50fd2139f46f7f7156d14ac221c3212368927a3b"}},"canonicalInputDigest":"e5b2e7f689edf7c17bbb292b5696fd40242c64e1931d5feb93cd6f1af2db7655","formatProfileId":"META_STATIC_VERTICAL_FULL","inputSchemaVersion":"1.2.0","manualAcceptanceStatus":{"items":[{"id":"M-001","reviewedAt":null,"reviewer":null,"status":"NOT_REVIEWED"},{"id":"M-002","reviewedAt":null,"reviewer":null,"status":"NOT_REVIEWED"},{"id":"M-003","reviewedAt":null,"reviewer":null,"status":"NOT_REVIEWED"},{"id":"M-004","reviewedAt":null,"reviewer":null,"status":"NOT_REVIEWED"},{"id":"M-005","reviewedAt":null,"reviewer":null,"status":"NOT_REVIEWED"},{"id":"M-006","reviewedAt":null,"reviewer":null,"status":"NOT_REVIEWED"}],"status":"NOT_REVIEWED"},"metaStaticReport":{"canvas":{"height":1920,"width":1080},"channel":"META","manualAcceptanceStatus":"NOT_REVIEWED","officialRatio":"9:16","placementContext":"INSTAGRAM_STORIES","platformCopy":{"callToAction":"Learn More","description":"설명 A","destinationUrl":"https://example.invalid/a","headline":"플랫폼 헤드라인 A","primaryText":"광고 본문 A"},"profileId":"META_STATIC_VERTICAL_FULL","projectPixelPresetId":"META_STATIC_VERTICAL_FULL_1080X1920","reelsGeometryStatus":"NOT_APPLICABLE","safeZonePolicy":{"classification":"PROJECT_GUIDE_ONLY","enforcement":"WARNING_ONLY","finalOverlay":false,"normalizedExclusion":{"bottom":0,"left":0,"right":0,"top":0},"sourceStatus":"OFFICIAL_RATIO_PROJECT_PIXEL_PRESET","storiesNormalizedExclusion":{"bottom":0.2,"left":0,"right":0,"top":0.14}}},"normalizedInputDigest":"e283a9b71b56c7033ad9810fbcdcf3b8e7020d965ebff7027a42f499035a611e","outputArtifactDigest":"7cf8008730915ad74c24c598356fa1a5965a0c4918dbd43f102a3efe992e03d3","outputEncoding":{"format":"PNG"},"outputFileName":"output.png","outputPngDigest":"7cf8008730915ad74c24c598356fa1a5965a0c4918dbd43f102a3efe992e03d3","outputSchemaVersion":"2.0.0","pixelFingerprint":"e283a9b71b56c7033ad9810fbcdcf3b8e7020d965ebff7027a42f499035a611e","requestFingerprint":"e5b2e7f689edf7c17bbb292b5696fd40242c64e1931d5feb93cd6f1af2db7655","schemaVersion":"1.0.0","templateContractVersion":"1.9.0","validatorResult":{"errorCount":0,"infoCount":0,"issues":[],"warningCount":0}}