{"assetDigests":{"approvedIcons":[],"fonts":[{"id":"NAVER_SC_NANUM_BARUN_GOTHIC_BOLD","sha256":"39bba4cd9bd2986143825c8654abbb62443914ab33b346c0c929a916f5d98bf2"},{"id":"NAVER_SC_NANUM_BARUN_GOTHIC_REGULAR","sha256":"9b872773134e2e4d8c0b17021266786576db06c843ede0d0b523b214a450756c"}],"images":[{"id":"NAVER_SMARTCHANNEL_OBJECT","sha256":"2e489607a0a573caf1763b59d022cc89a6b52918f07648985fa06f94ff2cc9b9"}],"product":{"id":"NAVER_SMARTCHANNEL_OBJECT","sha256":"2e489607a0a573caf1763b59d022cc89a6b52918f07648985fa06f94ff2cc9b9"},"referenceFixture":{"id":"NAVER_SMARTCHANNEL_TEMPLATE_CONTRACT","sha256":"c64b245e5401c71cee6ef01f66b5b7affd4f6877b47b86d576c297df954813b1"}},"canonicalInputDigest":"43982867e98fe3e65d48e5ad2b3a4cb4c3695d2cbaebeca73598d93af6cbf3f2","formatProfileId":"NAVER_GFA_SMARTCHANNEL","inputSchemaVersion":"1.2.0","manualAcceptanceStatus":{"items":[{"id":"M-001","reviewedAt":null,"reviewer":null,"status":"NOT_REVIEWED"},{"id":"M-002","reviewedAt":null,"reviewer":null,"status":"NOT_REVIEWED"},{"id":"M-003","reviewedAt":null,"reviewer":null,"status":"NOT_REVIEWED"},{"id":"M-004","reviewedAt":null,"reviewer":null,"status":"NOT_REVIEWED"},{"id":"M-005","reviewedAt":null,"reviewer":null,"status":"NOT_REVIEWED"},{"id":"M-006","reviewedAt":null,"reviewer":null,"status":"NOT_REVIEWED"}],"status":"NOT_REVIEWED"},"normalizedInputDigest":"43982867e98fe3e65d48e5ad2b3a4cb4c3695d2cbaebeca73598d93af6cbf3f2","outputPngDigest":"9864041dd041944c75720f820afc51f193e0f7b115b38eed1d8bbbecccaadd36","outputSchemaVersion":"2.0.0","pixelFingerprint":"7842783d32cb71a980bda4c09d75a2798916a1c399cd977bf3f9103ddb205e55","renderFingerprint":"7842783d32cb71a980bda4c09d75a2798916a1c399cd977bf3f9103ddb205e55","requestFingerprint":"43982867e98fe3e65d48e5ad2b3a4cb4c3695d2cbaebeca73598d93af6cbf3f2","schemaVersion":"1.0.0","smartChannelReport":{"artifact":{"bytes":13180,"pngDigest":"9864041dd041944c75720f820afc51f193e0f7b115b38eed1d8bbbecccaadd36"},"canvas":{"bitDepth":8,"colorType":"RGBA","format":"PNG","hasAlpha":true,"height":200,"width":750},"fixedComponents":[],"fonts":[{"digest":"39bba4cd9bd2986143825c8654abbb62443914ab33b346c0c929a916f5d98bf2","runtimePostScriptName":"NanumBarunGothicBold","token":"NAVER_SC_NANUM_BARUN_GOTHIC_BOLD"},{"digest":"9b872773134e2e4d8c0b17021266786576db06c843ede0d0b523b214a450756c","runtimePostScriptName":"NanumBarunGothic","token":"NAVER_SC_NANUM_BARUN_GOTHIC_REGULAR"}],"object":{"actualRasterBounds":{"height":48,"width":186,"x":512,"y":76},"alphaBounds":{"height":32,"width":124,"x":38,"y":10},"expectedRegion":{"height":140,"width":210,"x":500,"y":30},"finalBounds":{"height":48,"width":186,"x":512,"y":76},"frame":{"height":48,"width":186,"x":500,"y":30},"maxOpaquePixelCount":29120,"normalizedSize":{"height":48,"scale":1.5,"width":186},"opaquePixelCount":8364,"placementToken":"NAVER_SC_200_EMPHASIS_THUMBNAIL_RIGHT_NONE","sourceCanvas":{"height":60,"width":200},"sourceDigest":"2e489607a0a573caf1763b59d022cc89a6b52918f07648985fa06f94ff2cc9b9","sourceMimeType":"image/png","sourceRuleId":"NAVER_SC_THUMBNAIL_SLOT_LOCAL_SOURCE","targetRegion":{"height":140,"width":210,"x":500,"y":30},"transform":"NONE"},"objectPlacementToken":"NAVER_SC_200_EMPHASIS_THUMBNAIL_RIGHT_NONE","templateId":"NAVER_SMARTCHANNEL_200_EMPHASIS_THUMBNAIL_RIGHT_THREE_LINE_NONE","textRoles":[{"actualRasterBounds":{"height":30,"width":430,"x":40,"y":48},"baselineY":75.45703125,"box":{"height":30,"width":430,"x":40,"y":48},"expectedOrigin":{"x":38.9140625,"y":75.45703125},"inputKey":"headline","measuredWidth":207.66000347137447,"overflow":false,"role":"HEADLINE","sourceLayer":"메인카피 1행 : 한글 (최대 16자)","text":"새로운 영화 소식","typographyTokenId":"PSD_TYPE_TOKEN_a5c324cc30685123"},{"actualRasterBounds":{"height":27,"width":425,"x":40,"y":94},"baselineY":118.45703125,"box":{"height":27,"width":425,"x":40,"y":94},"expectedOrigin":{"x":38.9140625,"y":118.45703125},"inputKey":"subcopy","measuredWidth":211.96000671386722,"overflow":false,"role":"SUBCOPY","sourceLayer":"서브카피 2행 : 한글 (최대 18자)","text":"이번 주 추천 콘텐츠","typographyTokenId":"PSD_TYPE_TOKEN_aa2a6ba41ccadb3f"},{"actualRasterBounds":{"height":17,"width":156,"x":39,"y":136},"baselineY":151.45703125,"box":{"height":17,"width":156,"x":39,"y":136},"expectedOrigin":{"x":38.9140625,"y":151.45703125},"inputKey":"subcopyLine4","measuredWidth":114.0599967575073,"overflow":false,"role":"SUBCOPY","sourceLayer":"서브카피 3행 : 한글 (최대 30자)","text":"12세 이상 관람가","typographyTokenId":"PSD_TYPE_TOKEN_71ec8eca9b4b5e0e"}]},"templateContractVersion":"1.9.0","templateId":"NAVER_SMARTCHANNEL_200_EMPHASIS_THUMBNAIL_RIGHT_THREE_LINE_NONE","validatorResult":{"errorCount":0,"infoCount":0,"issues":[],"warningCount":0}}