{"appliedElements":[{"actualRasterBounds":{"height":805,"width":969,"x":231,"y":198},"assetDigest":"ea6a6ca53faba1215e45e7aa54ddcae33c5d75bbe6244e3aa6a3b2465656a57b","assetId":"image-banner-primary","destinationPixelRect":{"height":1200,"width":1200,"x":0,"y":0},"elementId":"image-banner-primary","elementType":"IMAGE","fitMode":"COVER","normalizedBounds":{"height":1,"width":1,"x":0,"y":0},"opacity":1,"originalArrayIndex":0,"placementPolicy":"MANUAL_CROP","requestedCropRect":{"height":1,"width":1,"x":0,"y":0},"resolvedSourceCropPixels":{"height":258,"width":1029,"x":0,"y":0},"zIndex":0},{"actualRasterBounds":{"height":238,"width":913,"x":144,"y":488},"assetDigest":"90a2e948d979b204867c837485ca0d4b391de4ca44c22ca36e9f3f53862ac75e","assetId":"image-banner-detail","destinationPixelRect":{"height":253,"width":1008,"x":96,"y":473},"elementId":"image-banner-detail","elementType":"IMAGE","fitMode":"CONTAIN","normalizedBounds":{"height":0.84,"width":0.84,"x":0.08,"y":0.08},"opacity":1,"originalArrayIndex":1,"placementPolicy":"CENTER_CONTAIN","zIndex":1}],"assetDigests":{"approvedIcons":[],"fonts":[{"id":"SPOQA_HAN_SANS_BOLD","sha256":"5a6b9b258145e243dfd5f70cc869119c6af708843658e380304bdfe3d4f4eaef"},{"id":"SPOQA_HAN_SANS_REGULAR","sha256":"1f56c8535b6592672ea7f540a67bb5792c34558d72875fc504166a3e2b28b4b1"}],"images":[{"id":"image-banner-detail","sha256":"90a2e948d979b204867c837485ca0d4b391de4ca44c22ca36e9f3f53862ac75e"},{"id":"image-banner-primary","sha256":"ea6a6ca53faba1215e45e7aa54ddcae33c5d75bbe6244e3aa6a3b2465656a57b"}],"product":{"id":"image-banner-detail","sha256":"90a2e948d979b204867c837485ca0d4b391de4ca44c22ca36e9f3f53862ac75e"},"referenceFixture":{"id":"KAKAO_TOOL_OBJECT_RIGHT_1029X258","sha256":"33204a082327bf14fead6dbc50fd2139f46f7f7156d14ac221c3212368927a3b"}},"canonicalInputDigest":"53da796d7a0d429717f493d0942712875c7b8c958c2078886e8396b64e176157","formatProfileId":"NAVER_IMAGE_BANNER_1_1","inputSchemaVersion":"1.2.0","manualAcceptanceStatus":{"items":[{"id":"M-001","reviewedAt":null,"reviewer":null,"status":"NOT_REVIEWED"},{"id":"M-002","reviewedAt":null,"reviewer":null,"status":"NOT_REVIEWED"},{"id":"M-003","reviewedAt":null,"reviewer":null,"status":"NOT_REVIEWED"},{"id":"M-004","reviewedAt":null,"reviewer":null,"status":"NOT_REVIEWED"},{"id":"M-005","reviewedAt":null,"reviewer":null,"status":"NOT_REVIEWED"},{"id":"M-006","reviewedAt":null,"reviewer":null,"status":"NOT_REVIEWED"}],"status":"NOT_REVIEWED"},"normalizedInputDigest":"68c0a496f1a98b8401f129cf012084f1313ef07bc722156e2a639a01272ad754","outputArtifactDigest":"8e737308eabdb84f9bef041443cc348f9ff7ae13096db90ebb72e0a58755ae3e","outputEncoding":{"format":"PNG"},"outputFileName":"output.png","outputPngDigest":"8e737308eabdb84f9bef041443cc348f9ff7ae13096db90ebb72e0a58755ae3e","outputSchemaVersion":"2.0.0","pixelFingerprint":"68c0a496f1a98b8401f129cf012084f1313ef07bc722156e2a639a01272ad754","requestFingerprint":"53da796d7a0d429717f493d0942712875c7b8c958c2078886e8396b64e176157","schemaVersion":"1.0.0","templateContractVersion":"1.9.0","validatorResult":{"errorCount":0,"infoCount":0,"issues":[],"warningCount":0}}