{"assetDigests":{"approvedIcons":[],"fonts":[{"id":"NAVER_SC_NANUM_BARUN_GOTHIC_BOLD","sha256":"39bba4cd9bd2986143825c8654abbb62443914ab33b346c0c929a916f5d98bf2"},{"id":"NAVER_SC_NANUM_BARUN_GOTHIC_REGULAR","sha256":"9b872773134e2e4d8c0b17021266786576db06c843ede0d0b523b214a450756c"}],"images":[{"id":"NAVER_SMARTCHANNEL_OBJECT","sha256":"2e489607a0a573caf1763b59d022cc89a6b52918f07648985fa06f94ff2cc9b9"}],"product":{"id":"NAVER_SMARTCHANNEL_OBJECT","sha256":"2e489607a0a573caf1763b59d022cc89a6b52918f07648985fa06f94ff2cc9b9"},"referenceFixture":{"id":"NAVER_SMARTCHANNEL_TEMPLATE_CONTRACT","sha256":"c64b245e5401c71cee6ef01f66b5b7affd4f6877b47b86d576c297df954813b1"}},"canonicalInputDigest":"01b3d268e6374881b368828024f875e74591c1a0777f094bb2c92f8ac1c1bbdd","formatProfileId":"NAVER_GFA_SMARTCHANNEL","inputSchemaVersion":"1.2.0","manualAcceptanceStatus":{"items":[{"id":"M-001","reviewedAt":null,"reviewer":null,"status":"NOT_REVIEWED"},{"id":"M-002","reviewedAt":null,"reviewer":null,"status":"NOT_REVIEWED"},{"id":"M-003","reviewedAt":null,"reviewer":null,"status":"NOT_REVIEWED"},{"id":"M-004","reviewedAt":null,"reviewer":null,"status":"NOT_REVIEWED"},{"id":"M-005","reviewedAt":null,"reviewer":null,"status":"NOT_REVIEWED"},{"id":"M-006","reviewedAt":null,"reviewer":null,"status":"NOT_REVIEWED"}],"status":"NOT_REVIEWED"},"normalizedInputDigest":"01b3d268e6374881b368828024f875e74591c1a0777f094bb2c92f8ac1c1bbdd","outputPngDigest":"137539fde736a384df8419437306768a0694cd1e179dc48b88dce46df957eaee","outputSchemaVersion":"2.0.0","pixelFingerprint":"1b3eeec864b76519af2de1f73a804c4cfeef196296e735506ebef859d6e8661c","renderFingerprint":"1b3eeec864b76519af2de1f73a804c4cfeef196296e735506ebef859d6e8661c","requestFingerprint":"01b3d268e6374881b368828024f875e74591c1a0777f094bb2c92f8ac1c1bbdd","schemaVersion":"1.0.0","smartChannelReport":{"artifact":{"bytes":11827,"pngDigest":"137539fde736a384df8419437306768a0694cd1e179dc48b88dce46df957eaee"},"canvas":{"bitDepth":8,"colorType":"RGBA","format":"PNG","hasAlpha":true,"height":160,"width":750},"fixedComponents":[],"fonts":[{"digest":"39bba4cd9bd2986143825c8654abbb62443914ab33b346c0c929a916f5d98bf2","runtimePostScriptName":"NanumBarunGothicBold","token":"NAVER_SC_NANUM_BARUN_GOTHIC_BOLD"},{"digest":"9b872773134e2e4d8c0b17021266786576db06c843ede0d0b523b214a450756c","runtimePostScriptName":"NanumBarunGothic","token":"NAVER_SC_NANUM_BARUN_GOTHIC_REGULAR"}],"object":{"actualRasterBounds":{"height":48,"width":186,"x":64,"y":56},"alphaBounds":{"height":32,"width":124,"x":38,"y":10},"expectedRegion":{"height":160,"width":235,"x":40,"y":0},"finalBounds":{"height":48,"width":186,"x":64,"y":56},"frame":{"height":48,"width":186,"x":40,"y":0},"maxOpaquePixelCount":29120,"normalizedSize":{"height":48,"scale":1.5,"width":186},"opaquePixelCount":8364,"placementToken":"NAVER_SC_160_BASIC_STANDARD_LEFT_NONE","sourceCanvas":{"height":60,"width":200},"sourceDigest":"2e489607a0a573caf1763b59d022cc89a6b52918f07648985fa06f94ff2cc9b9","sourceMimeType":"image/png","sourceRuleId":"NAVER_SC_STANDARD_FULL_CANVAS_SOURCE","targetRegion":{"height":160,"width":235,"x":40,"y":0},"transform":"NONE"},"objectPlacementToken":"NAVER_SC_160_BASIC_STANDARD_LEFT_NONE","templateId":"NAVER_SMARTCHANNEL_160_BASIC_STANDARD_LEFT_MAIN_SUB_NONE","textRoles":[{"actualRasterBounds":{"height":30,"width":403,"x":304,"y":45},"baselineY":72.45703125,"box":{"height":30,"width":403,"x":304,"y":45},"expectedOrigin":{"x":302.9140625,"y":72.45703125},"inputKey":"headline","measuredWidth":263.24000453949,"overflow":false,"role":"HEADLINE","sourceLayer":"메인카피 1행 : 한글","text":"브랜드의 새로운 시작","typographyTokenId":"PSD_TYPE_TOKEN_a5c324cc30685123"},{"actualRasterBounds":{"height":27,"width":400,"x":305,"y":89},"baselineY":113.45703125,"box":{"height":27,"width":400,"x":305,"y":89},"expectedOrigin":{"x":303.9140625,"y":113.45703125},"inputKey":"subcopy","measuredWidth":339.11001091003396,"overflow":false,"role":"SUBCOPY","sourceLayer":"서브카피 2행 : 한글","text":"매일 더 나은 선택을 만나보세요","typographyTokenId":"PSD_TYPE_TOKEN_aa2a6ba41ccadb3f"}]},"templateContractVersion":"1.9.0","templateId":"NAVER_SMARTCHANNEL_160_BASIC_STANDARD_LEFT_MAIN_SUB_NONE","validatorResult":{"errorCount":0,"infoCount":0,"issues":[],"warningCount":0}}