{"assetDigests":{"approvedIcons":[],"fonts":[{"id":"NAVER_SC_APPLE_SD_GOTHIC_NEO_BOLD","sha256":"0452cde17bbdfe71106680879df943034a003c537c95a4137bab124b3cfa4b66"},{"id":"NAVER_SC_APPLE_SD_GOTHIC_NEO_REGULAR","sha256":"0452cde17bbdfe71106680879df943034a003c537c95a4137bab124b3cfa4b66"},{"id":"NAVER_SC_APPLE_SD_GOTHIC_NEO_SEMIBOLD","sha256":"0452cde17bbdfe71106680879df943034a003c537c95a4137bab124b3cfa4b66"}],"images":[{"id":"NAVER_SMARTCHANNEL_OBJECT","sha256":"2e489607a0a573caf1763b59d022cc89a6b52918f07648985fa06f94ff2cc9b9"}],"product":{"id":"NAVER_SMARTCHANNEL_OBJECT","sha256":"2e489607a0a573caf1763b59d022cc89a6b52918f07648985fa06f94ff2cc9b9"},"referenceFixture":{"id":"NAVER_SMARTCHANNEL_TEMPLATE_CONTRACT","sha256":"686799ebbc70cf4bdea95315799a347e12185587eb8356138804665f448fe272"}},"canonicalInputDigest":"9acec930d596efb1b518d1ce5d797518237165d4a80e4eee1260aa57af81b3b7","formatProfileId":"NAVER_GFA_SMARTCHANNEL","inputSchemaVersion":"1.2.0","manualAcceptanceStatus":{"items":[{"id":"M-001","reviewedAt":null,"reviewer":null,"status":"NOT_REVIEWED"},{"id":"M-002","reviewedAt":null,"reviewer":null,"status":"NOT_REVIEWED"},{"id":"M-003","reviewedAt":null,"reviewer":null,"status":"NOT_REVIEWED"},{"id":"M-004","reviewedAt":null,"reviewer":null,"status":"NOT_REVIEWED"},{"id":"M-005","reviewedAt":null,"reviewer":null,"status":"NOT_REVIEWED"},{"id":"M-006","reviewedAt":null,"reviewer":null,"status":"NOT_REVIEWED"}],"status":"NOT_REVIEWED"},"normalizedInputDigest":"9acec930d596efb1b518d1ce5d797518237165d4a80e4eee1260aa57af81b3b7","outputPngDigest":"a2f2790bae1d12e76b0a766b9e1d9417fdd57b01e796d39359621cb876ff27d6","outputSchemaVersion":"2.0.0","pixelFingerprint":"66a1c6dea88ff1c400c886dd451fdb877f5f45b3c4991e1aadebd620a52a76ac","renderFingerprint":"66a1c6dea88ff1c400c886dd451fdb877f5f45b3c4991e1aadebd620a52a76ac","requestFingerprint":"9acec930d596efb1b518d1ce5d797518237165d4a80e4eee1260aa57af81b3b7","schemaVersion":"1.0.0","smartChannelReport":{"artifact":{"bytes":28145,"pngDigest":"a2f2790bae1d12e76b0a766b9e1d9417fdd57b01e796d39359621cb876ff27d6"},"canvas":{"bitDepth":8,"colorType":"RGBA","format":"PNG","hasAlpha":true,"height":280,"width":750},"fixedComponents":[],"fonts":[{"digest":"ae71ed736249e8c07191e6b7ec81d7ec8898f51fdc7d00ea49d2a6592e386cd7","runtimePostScriptName":"AppleSDGothicNeo-Bold","token":"NAVER_SC_APPLE_SD_GOTHIC_NEO_BOLD"},{"digest":"f41058fdd3ccdf7233abcef16d8d22f66c7dc35c14a5b4f665043f1ab20c86ff","runtimePostScriptName":"AppleSDGothicNeo-Regular","token":"NAVER_SC_APPLE_SD_GOTHIC_NEO_REGULAR"},{"digest":"e6aa5c5757cdb7f1b790dd0bfe6d627a4db2bd90a6751b4290733ae21419ba73","runtimePostScriptName":"AppleSDGothicNeo-SemiBold","token":"NAVER_SC_APPLE_SD_GOTHIC_NEO_SEMIBOLD"}],"object":{"actualRasterBounds":{"height":48,"width":186,"x":64,"y":116},"alphaBounds":{"height":32,"width":124,"x":38,"y":10},"expectedRegion":{"height":280,"width":235,"x":40,"y":0},"finalBounds":{"height":48,"width":186,"x":64,"y":116},"frame":{"height":48,"width":186,"x":40,"y":0},"maxOpaquePixelCount":29120,"normalizedSize":{"height":48,"scale":1.5,"width":186},"opaquePixelCount":8364,"placementToken":"NAVER_SC_280_BASIC_STANDARD_LEFT_NONE","sourceCanvas":{"height":60,"width":200},"sourceDigest":"2e489607a0a573caf1763b59d022cc89a6b52918f07648985fa06f94ff2cc9b9","sourceMimeType":"image/png","sourceRuleId":"NAVER_SC_STANDARD_FULL_CANVAS_SOURCE","targetRegion":{"height":280,"width":235,"x":40,"y":0},"transform":"NONE"},"objectPlacementToken":"NAVER_SC_280_BASIC_STANDARD_LEFT_NONE","templateId":"NAVER_SMARTCHANNEL_280_BASIC_STANDARD_LEFT_MAIN2_SUB_NONE","textRoles":[{"actualRasterBounds":{"height":32,"width":400,"x":304,"y":77},"baselineY":106.45703125,"box":{"height":32,"width":399,"x":305,"y":77},"expectedOrigin":{"x":302.9140625,"y":106.45703125},"horizontalOverflowEvidence":{"actualRasterBounds":{"height":32,"width":400,"x":304,"y":77},"actualRightEdge":703,"clipped":false,"decisionBasis":"ACTUAL_RASTER_BOUNDARY","diagnosticSurfaceClipped":false,"measuredWidth":401.1700096130371,"overflow":false,"rightBoundary":704},"inputKey":"headline","measuredWidth":401.1700096130371,"overflow":false,"rasterBaselineY":105.45703125,"role":"HEADLINE","sourceLayer":"메인카피 1행 : 한글","text":"일이삼사오륙칠팔구십일이삼사","typographyTokenId":"PSD_TYPE_TOKEN_3cb00cba41e436f4"},{"actualRasterBounds":{"height":32,"width":400,"x":304,"y":125},"baselineY":154.45703125,"box":{"height":32,"width":399,"x":305,"y":125},"expectedOrigin":{"x":302.9140625,"y":154.45703125},"horizontalOverflowEvidence":{"actualRasterBounds":{"height":32,"width":400,"x":304,"y":125},"actualRightEdge":703,"clipped":false,"decisionBasis":"ACTUAL_RASTER_BOUNDARY","diagnosticSurfaceClipped":false,"measuredWidth":401.1700096130371,"overflow":false,"rightBoundary":704},"inputKey":"headlineLine2","measuredWidth":401.1700096130371,"overflow":false,"rasterBaselineY":153.45703125,"role":"HEADLINE","sourceLayer":"메인카피 2행 : 한글","text":"일이삼사오륙칠팔구십일이삼사","typographyTokenId":"PSD_TYPE_TOKEN_3cb00cba41e436f4"},{"actualRasterBounds":{"height":27,"width":401,"x":305,"y":177},"baselineY":201.45703125,"box":{"height":27,"width":400,"x":305,"y":177},"expectedOrigin":{"x":303.9140625,"y":201.45703125},"horizontalOverflowEvidence":{"actualRasterBounds":{"height":27,"width":401,"x":305,"y":177},"actualRightEdge":705,"clipped":false,"decisionBasis":"ACTUAL_RASTER_BOUNDARY","diagnosticSurfaceClipped":false,"measuredWidth":403.3300025939938,"overflow":false,"rightBoundary":705},"inputKey":"subcopy","measuredWidth":403.3300025939938,"overflow":false,"rasterBaselineY":201.45703125,"role":"SUBCOPY","sourceLayer":"서브카피 2행 : 한글","text":"일이삼사오륙칠팔구십일이삼사오륙칠","typographyTokenId":"PSD_TYPE_TOKEN_aa2a6ba41ccadb3f"}]},"templateContractVersion":"1.9.0","templateId":"NAVER_SMARTCHANNEL_280_BASIC_STANDARD_LEFT_MAIN2_SUB_NONE","validatorResult":{"errorCount":0,"infoCount":0,"issues":[],"warningCount":0}}