{"appliedElements":[{"actualRasterBounds":{"height":1200,"width":1200,"x":0,"y":0},"assetDigest":"051b4199564b422c468a049bd977cface178f0d2b544e1ccc0a3adca3303b616","assetId":"asset-primary","destinationPixelRect":{"height":1200,"width":1200,"x":0,"y":0},"elementId":"image-1","elementType":"IMAGE","fitMode":"CONTAIN","normalizedBounds":{"height":1,"width":1,"x":0,"y":0},"opacity":1,"originalArrayIndex":0,"placementPolicy":"CENTER_CONTAIN","zIndex":0},{"actualRasterBounds":{"height":44,"width":183,"x":74,"y":152},"clipped":false,"color":"#20262D","destinationPixelRect":{"height":288,"width":744,"x":72,"y":144},"elementId":"text-1","elementType":"TEXT","fontAssetDigest":"1f56c8535b6592672ea7f540a67bb5792c34558d72875fc504166a3e2b28b4b1","fontId":"SPOQA_HAN_SANS_REGULAR","fontSizePx":48,"lineHeightPx":58,"normalizedBounds":{"height":0.24,"width":0.62,"x":0.06,"y":0.12},"opacity":1,"originalArrayIndex":1,"overflowDetected":false,"overflowMode":"ERROR","wrapMode":"NO_WRAP","zIndex":0}],"assetDigests":{"approvedIcons":[],"fonts":[{"id":"SPOQA_HAN_SANS_BOLD","sha256":"5a6b9b258145e243dfd5f70cc869119c6af708843658e380304bdfe3d4f4eaef"},{"id":"SPOQA_HAN_SANS_REGULAR","sha256":"1f56c8535b6592672ea7f540a67bb5792c34558d72875fc504166a3e2b28b4b1"}],"images":[{"id":"asset-primary","sha256":"051b4199564b422c468a049bd977cface178f0d2b544e1ccc0a3adca3303b616"}],"product":{"id":"asset-primary","sha256":"051b4199564b422c468a049bd977cface178f0d2b544e1ccc0a3adca3303b616"},"referenceFixture":{"id":"KAKAO_TOOL_OBJECT_RIGHT_1029X258","sha256":"33204a082327bf14fead6dbc50fd2139f46f7f7156d14ac221c3212368927a3b"}},"canonicalInputDigest":"358e344199d13c712bba5135e1fd5b677e7fefe4128bd21bacd3522136b4badd","formatProfileId":"NAVER_IMAGE_BANNER_1_1","inputSchemaVersion":"1.2.0","manualAcceptanceStatus":{"items":[{"id":"M-001","reviewedAt":null,"reviewer":null,"status":"NOT_REVIEWED"},{"id":"M-002","reviewedAt":null,"reviewer":null,"status":"NOT_REVIEWED"},{"id":"M-003","reviewedAt":null,"reviewer":null,"status":"NOT_REVIEWED"},{"id":"M-004","reviewedAt":null,"reviewer":null,"status":"NOT_REVIEWED"},{"id":"M-005","reviewedAt":null,"reviewer":null,"status":"NOT_REVIEWED"},{"id":"M-006","reviewedAt":null,"reviewer":null,"status":"NOT_REVIEWED"}],"status":"NOT_REVIEWED"},"normalizedInputDigest":"69278e6c208fcccd90c378b977730763d0465904c85cd616c6cb420b0aea79b2","outputArtifactDigest":"cc4ad67b4aec310faab0511a8d63e69ee2d5990dc906a960f3f1132cf3e33e28","outputEncoding":{"chromaSubsampling":"4:2:0","format":"JPEG","metadataStripped":true,"progressive":false,"qualityRequested":"AUTO_FIT","qualityResolved":76},"outputFileName":"output.jpg","outputPngDigest":"cc4ad67b4aec310faab0511a8d63e69ee2d5990dc906a960f3f1132cf3e33e28","outputSchemaVersion":"2.0.0","pixelFingerprint":"69278e6c208fcccd90c378b977730763d0465904c85cd616c6cb420b0aea79b2","requestFingerprint":"358e344199d13c712bba5135e1fd5b677e7fefe4128bd21bacd3522136b4badd","schemaVersion":"1.0.0","templateContractVersion":"1.9.0","validatorResult":{"errorCount":0,"infoCount":0,"issues":[],"warningCount":0}}