{"appliedElements":[{"actualRasterBounds":{"height":261,"width":493,"x":294,"y":415},"assetDigest":"fd5d6e48ebbf443f10f40af1b70091649b208bc7118f64dc3a990434915fc2fe","assetId":"hero","destinationPixelRect":{"height":332,"width":540,"x":270,"y":374},"elementId":"hero","elementType":"IMAGE","fitMode":"CONTAIN","normalizedBounds":{"height":0.64,"width":0.5,"x":0.25,"y":0.18},"opacity":1,"originalArrayIndex":0,"placementPolicy":"CENTER_CONTAIN","zIndex":0}],"assetDigests":{"approvedIcons":[],"fonts":[{"id":"SPOQA_HAN_SANS_BOLD","sha256":"5a6b9b258145e243dfd5f70cc869119c6af708843658e380304bdfe3d4f4eaef"},{"id":"SPOQA_HAN_SANS_REGULAR","sha256":"1f56c8535b6592672ea7f540a67bb5792c34558d72875fc504166a3e2b28b4b1"}],"images":[{"id":"hero","sha256":"fd5d6e48ebbf443f10f40af1b70091649b208bc7118f64dc3a990434915fc2fe"}],"product":{"id":"hero","sha256":"fd5d6e48ebbf443f10f40af1b70091649b208bc7118f64dc3a990434915fc2fe"},"referenceFixture":{"id":"KAKAO_TOOL_OBJECT_RIGHT_1029X258","sha256":"33204a082327bf14fead6dbc50fd2139f46f7f7156d14ac221c3212368927a3b"}},"canonicalInputDigest":"6d227fa67b3f9efe10b8f828ea58b3252ca6bf5ddd4e8e6bad7a00c0ba654c28","formatProfileId":"META_STATIC_FEED_SQUARE","inputSchemaVersion":"1.2.0","manualAcceptanceStatus":{"items":[{"id":"M-001","reviewedAt":null,"reviewer":null,"status":"NOT_REVIEWED"},{"id":"M-002","reviewedAt":null,"reviewer":null,"status":"NOT_REVIEWED"},{"id":"M-003","reviewedAt":null,"reviewer":null,"status":"NOT_REVIEWED"},{"id":"M-004","reviewedAt":null,"reviewer":null,"status":"NOT_REVIEWED"},{"id":"M-005","reviewedAt":null,"reviewer":null,"status":"NOT_REVIEWED"},{"id":"M-006","reviewedAt":null,"reviewer":null,"status":"NOT_REVIEWED"}],"status":"NOT_REVIEWED"},"metaStaticReport":{"canvas":{"height":1080,"width":1080},"channel":"META","manualAcceptanceStatus":"NOT_REVIEWED","officialRatio":"1:1","placementContext":"FACEBOOK_FEED","platformCopy":{"callToAction":"Learn More","description":"Description","destinationUrl":"https://example.invalid/meta","headline":"Square headline","primaryText":"Primary text metadata"},"profileId":"META_STATIC_FEED_SQUARE","projectPixelPresetId":"META_STATIC_FEED_SQUARE_1080X1080","reelsGeometryStatus":"NOT_APPLICABLE","safeZonePolicy":{"classification":"PROJECT_GUIDE_ONLY","enforcement":"WARNING_ONLY","finalOverlay":false,"normalizedExclusion":{"bottom":0,"left":0,"right":0,"top":0},"sourceStatus":"OFFICIAL_RATIO_PROJECT_PIXEL_PRESET","storiesNormalizedExclusion":{"bottom":0.2,"left":0,"right":0,"top":0.14}}},"normalizedInputDigest":"f7993c7268bf81ecf7896cc2eb52991c5db9f911aa01976a22d7f906a1a2a65b","outputArtifactDigest":"36a1ef405a1ec7b52b69a16e5cfb866e4582f74f35eff1426630d92d41158f54","outputEncoding":{"format":"PNG"},"outputFileName":"output.png","outputPngDigest":"36a1ef405a1ec7b52b69a16e5cfb866e4582f74f35eff1426630d92d41158f54","outputSchemaVersion":"2.0.0","pixelFingerprint":"f7993c7268bf81ecf7896cc2eb52991c5db9f911aa01976a22d7f906a1a2a65b","requestFingerprint":"6d227fa67b3f9efe10b8f828ea58b3252ca6bf5ddd4e8e6bad7a00c0ba654c28","schemaVersion":"1.0.0","templateContractVersion":"1.9.0","validatorResult":{"errorCount":0,"infoCount":0,"issues":[],"warningCount":0}}