{"appliedElements":[{"actualRasterBounds":{"height":1350,"width":1080,"x":0,"y":0},"assetDigest":"9dd206a7863d4ff6079e1352b54e1d7c1f0b9965e22b39127de244fe345159a5","assetId":"hero","destinationPixelRect":{"height":1350,"width":1080,"x":0,"y":0},"elementId":"hero","elementType":"IMAGE","fitMode":"COVER","normalizedBounds":{"height":1,"width":1,"x":0,"y":0},"opacity":1,"originalArrayIndex":0,"placementPolicy":"MANUAL_CROP","requestedCropRect":{"height":1,"width":0.533203125,"x":0.2333984375,"y":0},"resolvedSourceCropPixels":{"height":1365,"width":1092,"x":478,"y":0},"safeZoneImportance":"KEY_CREATIVE","zIndex":1}],"assetDigests":{"approvedIcons":[],"fonts":[{"id":"SPOQA_HAN_SANS_BOLD","sha256":"5a6b9b258145e243dfd5f70cc869119c6af708843658e380304bdfe3d4f4eaef"},{"id":"SPOQA_HAN_SANS_REGULAR","sha256":"1f56c8535b6592672ea7f540a67bb5792c34558d72875fc504166a3e2b28b4b1"}],"images":[{"id":"hero","sha256":"9dd206a7863d4ff6079e1352b54e1d7c1f0b9965e22b39127de244fe345159a5"}],"product":{"id":"hero","sha256":"9dd206a7863d4ff6079e1352b54e1d7c1f0b9965e22b39127de244fe345159a5"},"referenceFixture":{"id":"KAKAO_TOOL_OBJECT_RIGHT_1029X258","sha256":"33204a082327bf14fead6dbc50fd2139f46f7f7156d14ac221c3212368927a3b"}},"canonicalInputDigest":"6ee878563122b75f6ab31310d7461dd342dcc7495d2c9b05d9bb7300a54c097e","formatProfileId":"META_STATIC_FEED_PORTRAIT","inputSchemaVersion":"1.2.0","manualAcceptanceStatus":{"items":[{"id":"M-001","reviewedAt":null,"reviewer":null,"status":"NOT_REVIEWED"},{"id":"M-002","reviewedAt":null,"reviewer":null,"status":"NOT_REVIEWED"},{"id":"M-003","reviewedAt":null,"reviewer":null,"status":"NOT_REVIEWED"},{"id":"M-004","reviewedAt":null,"reviewer":null,"status":"NOT_REVIEWED"},{"id":"M-005","reviewedAt":null,"reviewer":null,"status":"NOT_REVIEWED"},{"id":"M-006","reviewedAt":null,"reviewer":null,"status":"NOT_REVIEWED"}],"status":"NOT_REVIEWED"},"metaStaticReport":{"canvas":{"height":1350,"width":1080},"channel":"META","manualAcceptanceStatus":"NOT_REVIEWED","officialRatio":"4:5","placementContext":"INSTAGRAM_FEED","platformCopy":{"callToAction":"Learn More","description":"M2.1 metadata only","destinationUrl":"https://example.invalid/m2-1","headline":"M2.1 metadata only","primaryText":"M2.1 metadata only"},"profileId":"META_STATIC_FEED_PORTRAIT","projectPixelPresetId":"META_STATIC_FEED_PORTRAIT_1080X1350","reelsGeometryStatus":"NOT_APPLICABLE","safeZonePolicy":{"classification":"PROJECT_GUIDE_ONLY","enforcement":"WARNING_ONLY","finalOverlay":false,"normalizedExclusion":{"bottom":0,"left":0,"right":0,"top":0},"sourceStatus":"OFFICIAL_RATIO_PROJECT_PIXEL_PRESET","storiesNormalizedExclusion":{"bottom":0.2,"left":0,"right":0,"top":0.14}}},"normalizedInputDigest":"10b650c6bdbd9ae31f1ed47c89051e7b608837fbad3f17ed84f2cf5b4f55c956","outputArtifactDigest":"22c38aea588be8b1fccf0d2c092a6709520c1890c91358b1c1396a3cfa956691","outputEncoding":{"chromaSubsampling":"4:2:0","format":"JPEG","metadataStripped":true,"progressive":false,"qualityRequested":92,"qualityResolved":92},"outputFileName":"output.jpg","outputPngDigest":"22c38aea588be8b1fccf0d2c092a6709520c1890c91358b1c1396a3cfa956691","outputSchemaVersion":"2.0.0","pixelFingerprint":"10b650c6bdbd9ae31f1ed47c89051e7b608837fbad3f17ed84f2cf5b4f55c956","requestFingerprint":"6ee878563122b75f6ab31310d7461dd342dcc7495d2c9b05d9bb7300a54c097e","schemaVersion":"1.0.0","templateContractVersion":"1.9.0","validatorResult":{"errorCount":0,"infoCount":0,"issues":[],"warningCount":0}}