{"appliedElements":[{"actualRasterBounds":{"height":69,"width":325,"x":88,"y":57},"clipped":false,"color":"#111111","destinationPixelRect":{"height":154,"width":908,"x":86,"y":38},"elementId":"headline","elementType":"TEXT","fontAssetDigest":"5a6b9b258145e243dfd5f70cc869119c6af708843658e380304bdfe3d4f4eaef","fontId":"SPOQA_HAN_SANS_BOLD","fontSizePx":72,"lineHeightPx":82,"normalizedBounds":{"height":0.08,"width":0.84,"x":0.08,"y":0.02},"opacity":1,"originalArrayIndex":0,"overflowDetected":false,"overflowMode":"ERROR","safeZoneImportance":"KEY_CREATIVE","wrapMode":"NO_WRAP","zIndex":1}],"assetDigests":{"approvedIcons":[],"fonts":[{"id":"SPOQA_HAN_SANS_BOLD","sha256":"5a6b9b258145e243dfd5f70cc869119c6af708843658e380304bdfe3d4f4eaef"},{"id":"SPOQA_HAN_SANS_REGULAR","sha256":"1f56c8535b6592672ea7f540a67bb5792c34558d72875fc504166a3e2b28b4b1"}],"images":[],"product":{"id":"FREEFORM_NONE","sha256":"e3b0c44298fc1c149afbf4c8996fb92427ae41e4649b934ca495991b7852b855"},"referenceFixture":{"id":"KAKAO_TOOL_OBJECT_RIGHT_1029X258","sha256":"33204a082327bf14fead6dbc50fd2139f46f7f7156d14ac221c3212368927a3b"}},"canonicalInputDigest":"0225fa6a610e3921fe93555212a7aa2a7cdec555cf673e6bdd2b29720337a7b6","formatProfileId":"META_STATIC_VERTICAL_FULL","inputSchemaVersion":"1.2.0","manualAcceptanceStatus":{"items":[{"id":"M-001","reviewedAt":null,"reviewer":null,"status":"NOT_REVIEWED"},{"id":"M-002","reviewedAt":null,"reviewer":null,"status":"NOT_REVIEWED"},{"id":"M-003","reviewedAt":null,"reviewer":null,"status":"NOT_REVIEWED"},{"id":"M-004","reviewedAt":null,"reviewer":null,"status":"NOT_REVIEWED"},{"id":"M-005","reviewedAt":null,"reviewer":null,"status":"NOT_REVIEWED"},{"id":"M-006","reviewedAt":null,"reviewer":null,"status":"NOT_REVIEWED"}],"status":"NOT_REVIEWED"},"metaStaticReport":{"canvas":{"height":1920,"width":1080},"channel":"META","manualAcceptanceStatus":"NOT_REVIEWED","officialRatio":"9:16","placementContext":"FACEBOOK_STORIES","platformCopy":null,"profileId":"META_STATIC_VERTICAL_FULL","projectPixelPresetId":"META_STATIC_VERTICAL_FULL_1080X1920","reelsGeometryStatus":"NOT_APPLICABLE","safeZonePolicy":{"classification":"PROJECT_GUIDE_ONLY","enforcement":"WARNING_ONLY","finalOverlay":false,"normalizedExclusion":{"bottom":0,"left":0,"right":0,"top":0},"sourceStatus":"OFFICIAL_RATIO_PROJECT_PIXEL_PRESET","storiesNormalizedExclusion":{"bottom":0.2,"left":0,"right":0,"top":0.14}}},"normalizedInputDigest":"dff859e807643cf7d8dd16aca0ee22b6efcd635df424dec731928dfc85444e5f","outputArtifactDigest":"618dbb56b3dc786bc26f4ee093df9daceac086dba13ff1ad5045f5ca3f988adb","outputEncoding":{"format":"PNG"},"outputFileName":"output.png","outputPngDigest":"618dbb56b3dc786bc26f4ee093df9daceac086dba13ff1ad5045f5ca3f988adb","outputSchemaVersion":"2.0.0","pixelFingerprint":"dff859e807643cf7d8dd16aca0ee22b6efcd635df424dec731928dfc85444e5f","requestFingerprint":"0225fa6a610e3921fe93555212a7aa2a7cdec555cf673e6bdd2b29720337a7b6","schemaVersion":"1.0.0","templateContractVersion":"1.9.0","validatorResult":{"errorCount":0,"infoCount":0,"issues":[{"actual":{"height":154,"width":908,"x":86,"y":38},"code":"KBR-META-STORIES-SAFE-ZONE-WARNING","elementId":"headline","expected":{"canvas":{"height":1920,"width":1080},"normalizedExclusion":{"bottom":0.2,"left":0,"right":0,"top":0.14},"pixelExclusion":{"bottom":384,"left":0,"right":0,"top":268.8}},"formatProfileId":"META_STATIC_VERTICAL_FULL","messageKey":"meta.stories_safe_zone_warning","path":"/creativeLayoutPlan/elements/0/bounds","severity":"WARNING","stage":"PRE_RENDER"}],"warningCount":1}}